{
  "schema_version": "part-coverage.v1",
  "task_id": "task-1",
  "packet_sha256": "0000000000000000000000000000000000000000000000000000000000000000",
  "part_id": "part-1",
  "source_version_ref": "fixture:source-v1",
  "delivery": "ATTACHED",
  "receipt_kind": "UI_OBSERVED",
  "received_claim_ref": null,
  "used_claim_ref": null,
  "direct_evidence_refs": [
    "fixture:filename-observation"
  ]
}
